"analitico_registro","analitico_humedad","analitico_s","analitico_t","analitico_ph_pasta","analitico_ph_h2o","analitico_ph_kcl","analitico_resistencia_pasta","analitico_base_ca","analitico_base_mg","analitico_base_k","analitico_base_na","analitico_arcilla","analitico_carbono_organico_c","analitico_carbono_organico_n","analitico_limo_2_20","analitico_limo_2_50","analitico_arena_muy_fina","analitico_arena_fina","analitico_arena_media","analitico_arena_gruesa","analitico_arena_muy_gruesa","analitico_arena_total","analitico_gravas","analitico_ca_co3","analitico_agua_15_atm","analitico_agua_util","analitico_conductividad","analitico_h","analitico_saturacion_t","analitico_saturacion_s_h","analitico_densidad_aparente","analitico_profundidad_muestra","analitico_agua_3_atm","analitico_carbono_organico_cn","analitico_base_al","analitico_p_ppm","barnices","co3","color_humedo_hvc","color_seco_hvc","concreciones","consistencia_en_seco","consistencia_en_humedo","consistencia_adhesividad","consistencia_plasticidad","estructura_tipo","estructura_clase","estructura_grado","formaciones_especiales","horizonte","humedad","id","limite_tipo","limite_forma","moteados","perfil_id","perfil_numero","perfil_profundidad_napa","perfil_cobertura_vegetal","perfil_material_original","perfil_modal","perfil_fecha","perfil_vegetacion_o_cultivos","perfil_observaciones","perfil_publico","perfil_capacidad_subclases","perfil_capacidad_clase","perfil_ubicacion_descripcion","perfil_ubicacion_recorrido","perfil_ubicacion_mosaico","perfil_ubicacion_aerofoto","perfil_ubicacion_latitud","perfil_ubicacion_longitud","perfil_paisaje_tipo","perfil_paisaje_forma","perfil_paisaje_simbolo","perfil_humedad_subclases","perfil_humedad_clase","perfil_erosion_clase","perfil_erosion_subclase","perfil_pedregosidad_clase","perfil_pedregosidad_subclase","perfil_serie_nombre","perfil_serie_simbolo","perfil_serie_descripcion","perfil_serie_provincia","perfil_grupo_codigo","perfil_grupo_descripcion","perfil_fase_codigo","perfil_fase_nombre","perfil_sales","perfil_uso_de_la_tierra","perfil_relieve","perfil_permeabilidad","perfil_escurrimiento","perfil_pendiente","perfil_anegamiento","perfil_drenaje","perfil_posicion","ph","profundidad_inferior","profundidad_superior","raices","textura"
"15808","","1.59","4.39","","5.68","","","1.0","0.5","0.05","0.04","","0.23","0.02","","","","","","","","","","","","","0.01","2.8","","","","0-23","","","","2.4","","Presencia de hierro reducido con alfa-alfa dipirimidil: Positivo.","7.5YR 5/6","7.5YR 6/4","","","suelto","no adhesivo","no plástico","bloques subangulares","medios","débil","Poros: XfV: Escasos, finos, vesiculares.","A1","Húmedo","11290","gradual","suave","","2493","CFI 1526","","80.0","Formación reciente y actual sobre Toropí - Yupoí.","no modal","2012-07-06","Gramíneas/herbáceas","FICHA PERTENECIENTE A CONVENIO PARCIALMENTE FINANCIADO POR EL CONSEJO FEDERAL DE INVERSIONES.
Limitantes: ee: Susceptibilidad a la erosión hídrica. F: Baja fertilidad natural.","true","e s","","En la estancia La Esperanza del Señor Ramirez Jorge Luis a 100 m. al Oeste del Casco y a 50 m. de la Ruta Provincial N° 26. Paraje El Sauce, Departamento Goya.","","","","-29.334694","-59.234833","Lomas arenosas","Lomas longitudinales","La L1","húmedo","uniforme","ligera","hídrica","","","La Esperanza","LEs","","Corrientes","","Cuartzipzamentes típicos","","","","ganadero-agrícola","normal","rápida","muy lento","1 - 3%","clase 1","clase 5","loma","5.9","23","0","Abundantes, finas, en matas en el techo del horizonte.","arenoso"
"15809","","1.35","4.31","","5.84","","","0.8","0.5","0.04","0.01","","0.22","0.02","","","","","","","","","","","","","0.01","2.92","","","","23-53","","","","1.7","","","7.5YR 4/6","7.5YR 5/4","","","suelto","no adhesivo","no plástico","bloques subangulares","medios","moderado","Poros: XfV: Escasos, finos, vesiculares.","A2","Húmedo","11291","difuso","suave","","2493","CFI 1526","","80.0","Formación reciente y actual sobre Toropí - Yupoí.","no modal","2012-07-06","Gramíneas/herbáceas","FICHA PERTENECIENTE A CONVENIO PARCIALMENTE FINANCIADO POR EL CONSEJO FEDERAL DE INVERSIONES.
Limitantes: ee: Susceptibilidad a la erosión hídrica. F: Baja fertilidad natural.","true","e s","","En la estancia La Esperanza del Señor Ramirez Jorge Luis a 100 m. al Oeste del Casco y a 50 m. de la Ruta Provincial N° 26. Paraje El Sauce, Departamento Goya.","","","","-29.334694","-59.234833","Lomas arenosas","Lomas longitudinales","La L1","húmedo","uniforme","ligera","hídrica","","","La Esperanza","LEs","","Corrientes","","Cuartzipzamentes típicos","","","","ganadero-agrícola","normal","rápida","muy lento","1 - 3%","clase 1","clase 5","loma","5.5","53","23","Comunes, finas, en toda el área.","arenoso"
"15810","","1.15","4.43","","5.74","","","0.6","0.5","0.03","0.02","","0.2","0.02","","","","","","","","","","","","","0.01","3.28","","","","53-67","","","","1.5","","","7.5YR 4/4","7.5YR 5/6","","","suelto","no adhesivo","no plástico","masiva","","","Poros: XfV: Escasos, finos, vesiculares. Hueco de hormiga.","C1","Húmedo","11292","difuso","suave","","2493","CFI 1526","","80.0","Formación reciente y actual sobre Toropí - Yupoí.","no modal","2012-07-06","Gramíneas/herbáceas","FICHA PERTENECIENTE A CONVENIO PARCIALMENTE FINANCIADO POR EL CONSEJO FEDERAL DE INVERSIONES.
Limitantes: ee: Susceptibilidad a la erosión hídrica. F: Baja fertilidad natural.","true","e s","","En la estancia La Esperanza del Señor Ramirez Jorge Luis a 100 m. al Oeste del Casco y a 50 m. de la Ruta Provincial N° 26. Paraje El Sauce, Departamento Goya.","","","","-29.334694","-59.234833","Lomas arenosas","Lomas longitudinales","La L1","húmedo","uniforme","ligera","hídrica","","","La Esperanza","LEs","","Corrientes","","Cuartzipzamentes típicos","","","","ganadero-agrícola","normal","rápida","muy lento","1 - 3%","clase 1","clase 5","loma","5.4","67","53","Comunes, finas, en toda el área.","arenoso"
"15811","","1.13","4.13","","5.77","","","0.7","0.4","0.02","0.01","","0.07","0.01","","","","","","","","","","","","","0.01","3.0","","","","67 +","","","","1.8","","","7.5YR 3/4","7.5YR 5/6","","","suelto","no adhesivo","no plástico","masiva","","","","C2","Húmedo","11293","","","","2493","CFI 1526","","80.0","Formación reciente y actual sobre Toropí - Yupoí.","no modal","2012-07-06","Gramíneas/herbáceas","FICHA PERTENECIENTE A CONVENIO PARCIALMENTE FINANCIADO POR EL CONSEJO FEDERAL DE INVERSIONES.
Limitantes: ee: Susceptibilidad a la erosión hídrica. F: Baja fertilidad natural.","true","e s","","En la estancia La Esperanza del Señor Ramirez Jorge Luis a 100 m. al Oeste del Casco y a 50 m. de la Ruta Provincial N° 26. Paraje El Sauce, Departamento Goya.","","","","-29.334694","-59.234833","Lomas arenosas","Lomas longitudinales","La L1","húmedo","uniforme","ligera","hídrica","","","La Esperanza","LEs","","Corrientes","","Cuartzipzamentes típicos","","","","ganadero-agrícola","normal","rápida","muy lento","1 - 3%","clase 1","clase 5","loma","5.2","","67","Escasas, finas, en toda el área.","arenoso"
