"analitico_registro","analitico_humedad","analitico_s","analitico_t","analitico_ph_pasta","analitico_ph_h2o","analitico_ph_kcl","analitico_resistencia_pasta","analitico_base_ca","analitico_base_mg","analitico_base_k","analitico_base_na","analitico_arcilla","analitico_carbono_organico_c","analitico_carbono_organico_n","analitico_limo_2_20","analitico_limo_2_50","analitico_arena_muy_fina","analitico_arena_fina","analitico_arena_media","analitico_arena_gruesa","analitico_arena_muy_gruesa","analitico_arena_total","analitico_gravas","analitico_ca_co3","analitico_agua_15_atm","analitico_agua_util","analitico_conductividad","analitico_h","analitico_saturacion_t","analitico_saturacion_s_h","analitico_densidad_aparente","analitico_profundidad_muestra","analitico_agua_3_atm","analitico_carbono_organico_cn","analitico_base_al","analitico_p_ppm","barnices","co3","color_humedo_hvc","color_seco_hvc","concreciones","consistencia_en_seco","consistencia_en_humedo","consistencia_adhesividad","consistencia_plasticidad","estructura_tipo","estructura_clase","estructura_grado","formaciones_especiales","horizonte","humedad","id","limite_tipo","limite_forma","moteados","perfil_id","perfil_numero","perfil_profundidad_napa","perfil_cobertura_vegetal","perfil_material_original","perfil_modal","perfil_fecha","perfil_vegetacion_o_cultivos","perfil_observaciones","perfil_publico","perfil_capacidad_subclases","perfil_capacidad_clase","perfil_ubicacion_descripcion","perfil_ubicacion_recorrido","perfil_ubicacion_mosaico","perfil_ubicacion_aerofoto","perfil_ubicacion_latitud","perfil_ubicacion_longitud","perfil_paisaje_tipo","perfil_paisaje_forma","perfil_paisaje_simbolo","perfil_humedad_subclases","perfil_humedad_clase","perfil_erosion_clase","perfil_erosion_subclase","perfil_pedregosidad_clase","perfil_pedregosidad_subclase","perfil_serie_nombre","perfil_serie_simbolo","perfil_serie_descripcion","perfil_serie_provincia","perfil_grupo_codigo","perfil_grupo_descripcion","perfil_fase_codigo","perfil_fase_nombre","perfil_sales","perfil_uso_de_la_tierra","perfil_relieve","perfil_permeabilidad","perfil_escurrimiento","perfil_pendiente","perfil_anegamiento","perfil_drenaje","perfil_posicion","ph","profundidad_inferior","profundidad_superior","raices","textura"
"","","4.42","10.5","","6.0","","","2.2","1.6","0.13","0.49","35.8","1.85","0.16","","23.9","4.06","26.46","8.32","1.04","0.42","40.3","","","8.9","14.6","0.07","6.08","42.0","","","0-13","23.4","3.2","","4.5","","Presencia de hierro reducido con alfa-alfa dipiridil: Positivo.","10YR 3/2","10YR 5/2","","","friable","adhesivo","plástico","laminar","","","","A","Húmedo","11294","abrupto","ondulado","RMF: MFO c1: Masas no cementadas de hierro oxidado, comunes, finos.","2494","CFI 1529","","70.0","Formación Toropí - Yupoí","modal","2012-06-08","Bosque abierto","FICHA PERTENECIENTE A CONVENIO PARCIALMENTE FINANCIADO POR EL CONSEJO FEDERAL DE INVERSIONES.
Limitantes: Pe: Profundidad efectiva restringida para las raíces. Na: Alcalinidad sódica.","true","s","","En el campo del Señor Silva a 2000 m. al Oeste de la Ruta Nacional N° 12 y a 3400 m. al Este del Río Paraná. Paraje Tres Bocas, Departamento Goya.","","","","-29.678889","-59.388778","Terraza media","Plano de terraza erosional","Pa M33","seco húmedo","no uniforme","moderada","hídrica","","","La Verónica","LVe","","Corrientes","","Natracuoles típicos, arcillosa fina","","","","ganadero","subnormal","lenta","medio","0 - 1%","clase 4","clase 2","tendido","6.5","13","0","Comunes, finas, en matas en el techo del horizonte.","franco arcilloso"
"","","10.92","13.41","","8.27","","","5.5","3.2","0.22","2.1","54.2","0.56","0.05","","22.9","2.06","10.06","10.16","0.44","0.18","22.9","","","19.8","16.3","0.41","2.48","85.0","","","13-38","36.0","1.0","","3.2","slck escasos, finos; clsk escasos, finos; esqueletanes escasos, finos.","","10YR 2/1","10YR 3/2","","","firme","adhesivo","plástico","columnar","gruesos","moderado","","Btn","Húmedo","11295","claro","suave","RMF: MFO e1: Masas no cementadas de hierro oxidado, escasos, finos. Mn e1: Masas no cementadas de manganeso, escasos, finos.","2494","CFI 1529","","70.0","Formación Toropí - Yupoí","modal","2012-06-08","Bosque abierto","FICHA PERTENECIENTE A CONVENIO PARCIALMENTE FINANCIADO POR EL CONSEJO FEDERAL DE INVERSIONES.
Limitantes: Pe: Profundidad efectiva restringida para las raíces. Na: Alcalinidad sódica.","true","s","","En el campo del Señor Silva a 2000 m. al Oeste de la Ruta Nacional N° 12 y a 3400 m. al Este del Río Paraná. Paraje Tres Bocas, Departamento Goya.","","","","-29.678889","-59.388778","Terraza media","Plano de terraza erosional","Pa M33","seco húmedo","no uniforme","moderada","hídrica","","","La Verónica","LVe","","Corrientes","","Natracuoles típicos, arcillosa fina","","","","ganadero","subnormal","lenta","medio","0 - 1%","clase 4","clase 2","tendido","8.4","38","13","Escasas, finas, entre agregados.","arcilloso"
"","","12.25","13.61","","8.74","","","7.6","2.4","0.22","2.09","42.3","0.34","0.03","","20.8","3.16","14.02","16.32","2.02","1.38","36.9","","","14.7","15.3","0.78","1.3","90.0","","","38-66","30.0","0.6","","3.0","clsk escasos, finos.","","10YR 4/1","10YR 3/2","Concreciones de carbonatos de calcio, comunes, medios.","","muy firme","adhesivo","plástico","bloques angulares","gruesos","fuerte","","Btkn1","Seco","11296","gradual","suave","RMF: Mn c1: Masas no cementadas de manganeso, comunes, finos.","2494","CFI 1529","","70.0","Formación Toropí - Yupoí","modal","2012-06-08","Bosque abierto","FICHA PERTENECIENTE A CONVENIO PARCIALMENTE FINANCIADO POR EL CONSEJO FEDERAL DE INVERSIONES.
Limitantes: Pe: Profundidad efectiva restringida para las raíces. Na: Alcalinidad sódica.","true","s","","En el campo del Señor Silva a 2000 m. al Oeste de la Ruta Nacional N° 12 y a 3400 m. al Este del Río Paraná. Paraje Tres Bocas, Departamento Goya.","","","","-29.678889","-59.388778","Terraza media","Plano de terraza erosional","Pa M33","seco húmedo","no uniforme","moderada","hídrica","","","La Verónica","LVe","","Corrientes","","Natracuoles típicos, arcillosa fina","","","","ganadero","subnormal","lenta","medio","0 - 1%","clase 4","clase 2","tendido","8.8","66","38","Escasas, muy finas, entre agregados.","arcilloso"
"","","11.57","12.97","","8.74","","","6.2","3.1","0.24","2.03","40.4","0.12","0.01","","20.8","7.7","14.94","13.72","1.7","0.74","38.8","","","13.9","14.8","0.64","1.4","89.0","","","66 +","28.7","0.2","","4.9","","","10YR 4/1","10YR 4/2","Concreciones de carbonatos de calcio, escasos, finos.","","muy firme","adhesivo","plástico","bloques angulares","gruesos","fuerte","","Btkn2","Húmedo","11297","","","RMF: MFO a2: Masas no cementadas de hierro oxidado, abundantes, medios. CFM c1: Concreciones cementadas de hierro manganeso, comunes, finos.","2494","CFI 1529","","70.0","Formación Toropí - Yupoí","modal","2012-06-08","Bosque abierto","FICHA PERTENECIENTE A CONVENIO PARCIALMENTE FINANCIADO POR EL CONSEJO FEDERAL DE INVERSIONES.
Limitantes: Pe: Profundidad efectiva restringida para las raíces. Na: Alcalinidad sódica.","true","s","","En el campo del Señor Silva a 2000 m. al Oeste de la Ruta Nacional N° 12 y a 3400 m. al Este del Río Paraná. Paraje Tres Bocas, Departamento Goya.","","","","-29.678889","-59.388778","Terraza media","Plano de terraza erosional","Pa M33","seco húmedo","no uniforme","moderada","hídrica","","","La Verónica","LVe","","Corrientes","","Natracuoles típicos, arcillosa fina","","","","ganadero","subnormal","lenta","medio","0 - 1%","clase 4","clase 2","tendido","8.5","","66","","franco arcilloso"
