"analitico_registro","analitico_humedad","analitico_s","analitico_t","analitico_ph_pasta","analitico_ph_h2o","analitico_ph_kcl","analitico_resistencia_pasta","analitico_base_ca","analitico_base_mg","analitico_base_k","analitico_base_na","analitico_arcilla","analitico_carbono_organico_c","analitico_carbono_organico_n","analitico_limo_2_20","analitico_limo_2_50","analitico_arena_muy_fina","analitico_arena_fina","analitico_arena_media","analitico_arena_gruesa","analitico_arena_muy_gruesa","analitico_arena_total","analitico_gravas","analitico_ca_co3","analitico_agua_15_atm","analitico_agua_util","analitico_conductividad","analitico_h","analitico_saturacion_t","analitico_saturacion_s_h","analitico_densidad_aparente","analitico_profundidad_muestra","analitico_agua_3_atm","analitico_carbono_organico_cn","analitico_base_al","analitico_p_ppm","barnices","co3","color_humedo_hvc","color_seco_hvc","concreciones","consistencia_en_seco","consistencia_en_humedo","consistencia_adhesividad","consistencia_plasticidad","estructura_tipo","estructura_clase","estructura_grado","formaciones_especiales","horizonte","humedad","id","limite_tipo","limite_forma","moteados","perfil_id","perfil_numero","perfil_profundidad_napa","perfil_cobertura_vegetal","perfil_material_original","perfil_modal","perfil_fecha","perfil_vegetacion_o_cultivos","perfil_observaciones","perfil_publico","perfil_capacidad_subclases","perfil_capacidad_clase","perfil_ubicacion_descripcion","perfil_ubicacion_recorrido","perfil_ubicacion_mosaico","perfil_ubicacion_aerofoto","perfil_ubicacion_latitud","perfil_ubicacion_longitud","perfil_paisaje_tipo","perfil_paisaje_forma","perfil_paisaje_simbolo","perfil_humedad_subclases","perfil_humedad_clase","perfil_erosion_clase","perfil_erosion_subclase","perfil_pedregosidad_clase","perfil_pedregosidad_subclase","perfil_serie_nombre","perfil_serie_simbolo","perfil_serie_descripcion","perfil_serie_provincia","perfil_grupo_codigo","perfil_grupo_descripcion","perfil_fase_codigo","perfil_fase_nombre","perfil_sales","perfil_uso_de_la_tierra","perfil_relieve","perfil_permeabilidad","perfil_escurrimiento","perfil_pendiente","perfil_anegamiento","perfil_drenaje","perfil_posicion","ph","profundidad_inferior","profundidad_superior","raices","textura"
"","","","14.8","6.85","","","2000.0","","","0.65","0.38","7.3","0.33","0.01","","10.4","","","","","","82.3","0.1","","4.5","","","","100.0","","","0-7","6.45","33.0","","","","","10YR 3/2","10YR 5/4","","blando","friable","no adhesivo","no plástico","masiva","","","Granuloso a guijarroso","A1","","13810","claro","suave","","3050","Perfil 56","","","","no modal","1990-11-01","Estepa arbustiva (Jarilla, Pichana)","a) Altitud: 500 metros, relieve muy ligeramente ondulado
b) la ubicación por coordenadas geográficas de la publicación original fue ajustada utilizando como referencia la ubicación referida en la descripción morfológica","true","","","Sobre camino a Cutral-Co, 20 km de Picún Leufú","","","","-39.380833","-69.404722","Geomorfología: Meseta","","","","","","","","","Perfil 56","","","Neuquén","","Torripsamentes típico","","","","","","","","","","clase 4","","","7","0","rrr","areno franco"
"","","","12.3","7.45","","","2300.0","","","0.46","0.38","5.6","0.16","0.02","","11.0","","","","","","83.5","0.1","","4.9","","","","100.0","","","7-56","6.87","8.0","","","","","10YR 3/3","","","blando","friable","no adhesivo","no plástico","masiva","","","ligeramente granuloso a ligeramente guijarroso","C1","","13811","abrupto","ondulado","","3050","Perfil 56","","","","no modal","1990-11-01","Estepa arbustiva (Jarilla, Pichana)","a) Altitud: 500 metros, relieve muy ligeramente ondulado
b) la ubicación por coordenadas geográficas de la publicación original fue ajustada utilizando como referencia la ubicación referida en la descripción morfológica","true","","","Sobre camino a Cutral-Co, 20 km de Picún Leufú","","","","-39.380833","-69.404722","Geomorfología: Meseta","","","","","","","","","Perfil 56","","","Neuquén","","Torripsamentes típico","","","","","","","","","","clase 4","","","56","7","rrr","areno franco"
"","","","13.7","7.55","","","1800.0","","","0.18","0.56","6.8","","","","11.6","","","","","","81.6","0.1","2.5","5.0","","","","100.0","","","56-88","7.45","","","","","","10YR 3/3","","","","friable","no adhesivo","no plástico","grano suelto","","","granuloso a guijarroso, calcáreo","C2ca","","13812","abrupto","ondulado","","3050","Perfil 56","","","","no modal","1990-11-01","Estepa arbustiva (Jarilla, Pichana)","a) Altitud: 500 metros, relieve muy ligeramente ondulado
b) la ubicación por coordenadas geográficas de la publicación original fue ajustada utilizando como referencia la ubicación referida en la descripción morfológica","true","","","Sobre camino a Cutral-Co, 20 km de Picún Leufú","","","","-39.380833","-69.404722","Geomorfología: Meseta","","","","","","","","","Perfil 56","","","Neuquén","","Torripsamentes típico","","","","","","","","","","clase 4","","","88","56","r","areno franco"
"","","","7.6","7.45","","","3600.0","","","0.12","0.3","7.9","","","","4.0","","","","","","88.0","15.0","10.1","4.4","","","","100.0","","","88-114","6.4","","","","","","10YR 8/2","","","","","","","","","","sábulo a grava mediano, calcáreo (concentraciones localizadas calcáreas ligeramente endurecidas)","II C3ca","","13813","","","","3050","Perfil 56","","","","no modal","1990-11-01","Estepa arbustiva (Jarilla, Pichana)","a) Altitud: 500 metros, relieve muy ligeramente ondulado
b) la ubicación por coordenadas geográficas de la publicación original fue ajustada utilizando como referencia la ubicación referida en la descripción morfológica","true","","","Sobre camino a Cutral-Co, 20 km de Picún Leufú","","","","-39.380833","-69.404722","Geomorfología: Meseta","","","","","","","","","Perfil 56","","","Neuquén","","Torripsamentes típico","","","","","","","","","","clase 4","","","114","88","","areno franco"
