"analitico_registro","analitico_humedad","analitico_s","analitico_t","analitico_ph_pasta","analitico_ph_h2o","analitico_ph_kcl","analitico_resistencia_pasta","analitico_base_ca","analitico_base_mg","analitico_base_k","analitico_base_na","analitico_arcilla","analitico_carbono_organico_c","analitico_carbono_organico_n","analitico_limo_2_20","analitico_limo_2_50","analitico_arena_muy_fina","analitico_arena_fina","analitico_arena_media","analitico_arena_gruesa","analitico_arena_muy_gruesa","analitico_arena_total","analitico_gravas","analitico_ca_co3","analitico_agua_15_atm","analitico_agua_util","analitico_conductividad","analitico_h","analitico_saturacion_t","analitico_saturacion_s_h","analitico_densidad_aparente","analitico_profundidad_muestra","analitico_agua_3_atm","analitico_carbono_organico_cn","analitico_base_al","analitico_p_ppm","barnices","co3","color_humedo_hvc","color_seco_hvc","concreciones","consistencia_en_seco","consistencia_en_humedo","consistencia_adhesividad","consistencia_plasticidad","estructura_tipo","estructura_clase","estructura_grado","formaciones_especiales","horizonte","humedad","id","limite_tipo","limite_forma","moteados","perfil_id","perfil_numero","perfil_profundidad_napa","perfil_cobertura_vegetal","perfil_material_original","perfil_modal","perfil_fecha","perfil_vegetacion_o_cultivos","perfil_observaciones","perfil_publico","perfil_capacidad_subclases","perfil_capacidad_clase","perfil_ubicacion_descripcion","perfil_ubicacion_recorrido","perfil_ubicacion_mosaico","perfil_ubicacion_aerofoto","perfil_ubicacion_latitud","perfil_ubicacion_longitud","perfil_paisaje_tipo","perfil_paisaje_forma","perfil_paisaje_simbolo","perfil_humedad_subclases","perfil_humedad_clase","perfil_erosion_clase","perfil_erosion_subclase","perfil_pedregosidad_clase","perfil_pedregosidad_subclase","perfil_serie_nombre","perfil_serie_simbolo","perfil_serie_descripcion","perfil_serie_provincia","perfil_grupo_codigo","perfil_grupo_descripcion","perfil_fase_codigo","perfil_fase_nombre","perfil_sales","perfil_uso_de_la_tierra","perfil_relieve","perfil_permeabilidad","perfil_escurrimiento","perfil_pendiente","perfil_anegamiento","perfil_drenaje","perfil_posicion","ph","profundidad_inferior","profundidad_superior","raices","textura"
"","","","14.7","7.95","","","1300.0","","","0.83","0.47","7.4","0.29","0.057","","9.5","","","","","","83.2","32.0","2.5","","","","","100.0","","","0-5","","5.1","","","","","","2.5Y 6/2","","suelto","","no adhesivo","no plástico","grano suelto","","","Granuloso a guijarroso; estructura con tendencia a bloques subangulares medios débiles; ligeramente calcáreo","A1","","14391","abrupto","suave","","3183","Perfil 120","","","","no modal","1990-11-01","Estepa arbustiva (Jarilla)","Altitud: 900 metros
Superficie del suelo: cubierta detrítica (50%)","true","","","Margen derecha del arroyo Quintuco","","","","-38.166667","-70.2","Geomorfología: Terraza alta del arroyo","","","","","","","","","Perfil 120","","","Neuquén","","Torriortente típico","","","","","","","","","","","","","5","0","","areno franco"
"","","","12.8","7.9","","","1900.0","","","0.77","0.51","7.3","0.23","0.041","","4.9","","","","","","87.8","19.0","2.4","","","","","100.0","","","5-90","","5.6","","","","","2.5Y 3.5/2","2.5Y 3.5/2","","suelto","muy friable","no adhesivo","no plástico","grano suelto","","","Granuloso a guijarroso; ligeramente calcáreo","C1","","14392","abrupto","suave","","3183","Perfil 120","","","","no modal","1990-11-01","Estepa arbustiva (Jarilla)","Altitud: 900 metros
Superficie del suelo: cubierta detrítica (50%)","true","","","Margen derecha del arroyo Quintuco","","","","-38.166667","-70.2","Geomorfología: Terraza alta del arroyo","","","","","","","","","Perfil 120","","","Neuquén","","Torriortente típico","","","","","","","","","","","","","90","5","","areno franco"
"","","","14.3","7.9","","","1300.0","","","0.13","0.61","6.4","","","","7.8","","","","","","85.6","30.0","7.9","","","","","100.0","","","90+","","","","","","","N 6.5/0","","","","","no adhesivo","no plástico","grano suelto","","","Granuloso a guijarroso; calcáreo","II C2ca","","14393","","","","3183","Perfil 120","","","","no modal","1990-11-01","Estepa arbustiva (Jarilla)","Altitud: 900 metros
Superficie del suelo: cubierta detrítica (50%)","true","","","Margen derecha del arroyo Quintuco","","","","-38.166667","-70.2","Geomorfología: Terraza alta del arroyo","","","","","","","","","Perfil 120","","","Neuquén","","Torriortente típico","","","","","","","","","","","","","100","90","","areno franco"
